{
  "$schema": "https://json-schema.org/draft/2020-12/schema",
  "$id": "https://media-monitor/contracts/site_snapshot.v2.json",
  "title": "site_snapshot.v2",
  "description": "Immutable public deployment snapshot separating human-approved editorial publication from monitored source signals.",
  "type": "object",
  "additionalProperties": false,
  "properties": {
    "schema_name": {"const": "site_snapshot.v2"},
    "snapshot_id": {"type": "string", "pattern": "^[a-f0-9]{64}$"},
    "site": {
      "type": "object",
      "additionalProperties": false,
      "properties": {
        "site_id": {"type": "string", "minLength": 1},
        "name": {"type": "string", "minLength": 1},
        "tagline": {"type": "string", "minLength": 1},
        "locale": {"type": "string", "minLength": 1}
      },
      "required": ["site_id", "name", "tagline", "locale"]
    },
    "digest_at": {"type": "string", "pattern": "^[0-9]{8}T[0-9]{2}$"},
    "generated_at": {"type": "string", "format": "date-time"},
    "status": {"const": "ok"},
    "metrics": {
      "type": "object",
      "additionalProperties": false,
      "properties": {
        "item_count": {"type": "integer", "minimum": 1},
        "section_count": {"type": "integer", "minimum": 1},
        "published_article_count": {"type": "integer", "minimum": 0}
      },
      "required": ["item_count", "section_count", "published_article_count"]
    },
    "publication": {
      "type": "object",
      "additionalProperties": false,
      "properties": {
        "featured": {
          "oneOf": [
            {"type": "null"},
            {"$ref": "#/$defs/publication_ref"}
          ]
        },
        "latest": {
          "type": "array",
          "items": {"$ref": "#/$defs/publication_ref"}
        }
      },
      "required": ["featured", "latest"]
    },
    "signals": {
      "type": "object",
      "additionalProperties": false,
      "properties": {
        "hero": {"$ref": "#/$defs/signal_item"},
        "latest": {
          "type": "array",
          "minItems": 1,
          "items": {"$ref": "#/$defs/signal_item"}
        },
        "sections": {
          "type": "array",
          "minItems": 1,
          "items": {"$ref": "#/$defs/signal_section"}
        }
      },
      "required": ["hero", "latest", "sections"]
    },
    "articles": {
      "type": "object",
      "propertyNames": {"pattern": "^[a-z0-9]+(?:-[a-z0-9]+)*$"},
      "additionalProperties": {"$ref": "#/$defs/published_article"}
    },
    "provenance": {
      "type": "object",
      "additionalProperties": false,
      "properties": {
        "refs_path": {"type": "string", "minLength": 1},
        "refs_sha256": {"type": "string", "pattern": "^[a-f0-9]{64}$"},
        "groups_path": {"type": "string", "minLength": 1},
        "groups_sha256": {"type": "string", "pattern": "^[a-f0-9]{64}$"},
        "published_articles_path": {"type": "string", "minLength": 1},
        "published_articles_sha256": {"type": "string", "pattern": "^[a-f0-9]{64}$"},
        "git_sha": {"type": "string", "minLength": 1}
      },
      "required": [
        "refs_path",
        "refs_sha256",
        "groups_path",
        "groups_sha256",
        "published_articles_path",
        "published_articles_sha256",
        "git_sha"
      ]
    }
  },
  "required": [
    "schema_name",
    "snapshot_id",
    "site",
    "digest_at",
    "generated_at",
    "status",
    "metrics",
    "publication",
    "signals",
    "articles",
    "provenance"
  ],
  "$defs": {
    "signal_item": {
      "type": "object",
      "additionalProperties": false,
      "properties": {
        "index_id": {"type": "string", "minLength": 1},
        "title": {"type": "string", "minLength": 1},
        "topic": {"type": "string", "minLength": 1},
        "published_at": {"type": "string", "format": "date-time"},
        "link": {"type": "string", "format": "uri"},
        "source": {"type": "string"}
      },
      "required": ["index_id", "title", "topic", "published_at", "link", "source"]
    },
    "signal_section": {
      "type": "object",
      "additionalProperties": false,
      "properties": {
        "topic": {"type": "string", "minLength": 1},
        "article_count": {"type": "integer", "minimum": 0},
        "top_titles": {"type": "array", "items": {"type": "string"}}
      },
      "required": ["topic", "article_count", "top_titles"]
    },
    "publication_ref": {
      "type": "object",
      "additionalProperties": false,
      "properties": {
        "article_id": {"type": "string", "minLength": 1},
        "slug": {"type": "string", "pattern": "^[a-z0-9]+(?:-[a-z0-9]+)*$"},
        "title": {"type": "string", "minLength": 1},
        "summary": {"type": "string", "minLength": 1},
        "topic": {"type": "string", "minLength": 1},
        "published_at": {"type": "string", "format": "date-time"},
        "updated_at": {"type": "string", "format": "date-time"}
      },
      "required": ["article_id", "slug", "title", "summary", "topic", "published_at", "updated_at"]
    },
    "citation": {
      "type": "object",
      "additionalProperties": false,
      "properties": {
        "citation_id": {"type": "string", "minLength": 1},
        "claim_text": {"type": "string", "minLength": 1},
        "source_ref_id": {"type": "string", "minLength": 1},
        "url": {"type": "string", "format": "uri"}
      },
      "required": ["citation_id", "claim_text", "source_ref_id", "url"]
    },
    "published_article": {
      "type": "object",
      "additionalProperties": false,
      "properties": {
        "schema_name": {"const": "published_article.v1"},
        "article_id": {"type": "string", "minLength": 1},
        "draft_id": {"type": "string", "minLength": 1},
        "digest_at": {"type": "string", "pattern": "^[0-9]{8}T[0-9]{2}$"},
        "story_group_id": {"type": "string", "minLength": 1},
        "slug": {"type": "string", "pattern": "^[a-z0-9]+(?:-[a-z0-9]+)*$"},
        "title": {"type": "string", "minLength": 1},
        "summary": {"type": "string", "minLength": 1},
        "body_md": {"type": "string", "minLength": 1},
        "topic": {"type": "string", "minLength": 1},
        "source_links": {
          "type": "array",
          "minItems": 1,
          "items": {"type": "string", "format": "uri"}
        },
        "citations": {
          "type": "array",
          "items": {"$ref": "#/$defs/citation"}
        },
        "status": {"const": "published"},
        "review_status": {"type": "string", "minLength": 1},
        "published_at": {"type": "string", "format": "date-time"},
        "updated_at": {"type": "string", "format": "date-time"}
      },
      "required": [
        "schema_name",
        "article_id",
        "draft_id",
        "digest_at",
        "story_group_id",
        "slug",
        "title",
        "summary",
        "body_md",
        "topic",
        "source_links",
        "citations",
        "status",
        "review_status",
        "published_at",
        "updated_at"
      ]
    }
  }
}
